"NEQLI7E6","journalArticle","2000","Sylvia Göthberg, Karl Erik Edberg","Inhaled Nitric Oxide to Newborns and Infants after Congenital Heart Surgery on Cardiopulmonary Bypass: A Dose-response Study","Scandinavian Cardiovascular Journal","","1401-7431, 1651-2006","10.1080/14017430050142161","http://www.tandfonline.com/doi/full/10.1080/14017430050142161","","2000-01","2025-05-21 21:10:10","2025-05-21 21:10:10","2025-05-21 21:10:10","154-158","","2","34","","Scandinavian Cardiovascular Journal","Inhaled Nitric Oxide to Newborns and Infants after Congenital Heart Surgery on Cardiopulmonary Bypass","","","","","","","en","","","","","DOI.org (Crossref)","","","","","","","","","","","","","","","","","","","","","","","","","","","","","","","","","","","","","","","","","","","","","","","","","","","","",""
"KLXLEL96","journalArticle","2000","Maila I. Turanlahti, Pirjo O. Laiti","Preoperative and Postoperative Response to Inhaled Nitric Oxide","Scandinavian Cardiovascular Journal","","1401-7431, 1651-2006","10.1080/14017430050142396","http://www.tandfonline.com/doi/full/10.1080/14017430050142396","","2000-01","2025-05-21 21:10:11","2025-05-21 21:10:11","2025-05-21 21:10:11","46-52","","1","34","","Scandinavian Cardiovascular Journal","","","","","","","","en","","","","","DOI.org (Crossref)","","","","","","","","","","","","","","","","","","","","","","","","","","","","","","","","","","","","","","","","","","","","","","","","","","","","",""
"RRCFQISQ","journalArticle","2014","Lopes, Antonio Augusto; Barst, Robyn J.; Haworth, Sheila Glennis; Rabinovitch, Marlene; Dabbagh, Maha Al; Del Cerro, Maria Jesus; Ivy, Dunbar; Kashour, Tarek; Kumar, Krishna; Harikrishnan, S.; D'Alto, Michele; Thomaz, Ana Maria; Zorzanelli, Leína; Aiello, Vera D.; Mocumbi, Ana Olga; Santana, Maria Virginia T.; Galal, Ahmed Nasser; Banjar, Hanaa; Tamimi, Omar; Heath, Alexandra; Flores, Patricia C.; Diaz, Gabriel; Sandoval, Julio; Kothari, Shyam; Moledina, Shahin; Gonçalves, Rilvani C.; Barreto, Alessandra C.; Binotto, Maria Angélica; Maia, Margarida; Habshan, Fahad Al; Adatia, Ian","Repair of Congenital Heart Disease with Associated Pulmonary Hypertension in Children: What are the Minimal Investigative Procedures? Consensus Statement from the Congenital Heart Disease and Pediatric Task Forces, Pulmonary Vascular Research Institute (PVRI)","Pulmonary Circulation","","2045-8940, 2045-8940","10.1086/675995","https://onlinelibrary.wiley.com/doi/10.1086/675995","Standardization of the diagnostic routine for children with congenital heart disease associated with pulmonary arterial hypertension (PAH‐CHD) is crucial, in particular since inappropriate assignment to repair of the cardiac lesions (e.g., surgical repair in patients with elevated pulmonary vascular resistance) may be detrimental and associated with poor outcomes. Thus, members of the Congenital Heart Disease and Pediatric Task Forces of the Pulmonary Vascular Research Institute decided to conduct a survey aimed at collecting expert opinion from different institutions in several countries, covering many aspects of the management of PAH‐CHD, from clinical recognition to noninvasive and invasive diagnostic procedures and immediate postoperative support. In privileged communities, the vast majority of children with congenital cardiac shunts are now treated early in life, on the basis of noninvasive diagnostic evaluation, and have an uneventful postoperative course, with no residual PAH. However, a small percentage of patients (older at presentation, with extracardiac syndromes or absence of clinical features of increased pulmonary blood flow, thus suggesting elevated pulmonary vascular resistance) remain at a higher risk of complications and unfavorable outcomes. These patients need a more sophisticated diagnostic approach, including invasive procedures. The authors emphasize that decision making regarding operability is based not only on cardiac catheterization data but also on the complete diagnostic picture, which includes the clinical history, physical examination, and all aspects of noninvasive evaluation.","2014-06","2025-05-21 21:10:12","2025-05-21 21:10:12","2025-05-21 21:10:12","330-341","","2","4","","Pulm. circ.","Repair of Congenital Heart Disease with Associated Pulmonary Hypertension in Children","","","","","","","en","http://onlinelibrary.wiley.com/termsAndConditions#vor","","","","DOI.org (Crossref)","","","","/home/fgsj/Zotero/storage/XQPYYISJ/Lopes et al. - 2014 - Repair of Congenital Heart Disease with Associated Pulmonary Hypertension in Children What are the.pdf","","","","","","","","","","","","","","","","","","","","","","","","","","","","","","","","","","","","","","","","","","","","","","","","",""
"6KDCNTC9","journalArticle","2021","Arvanitaki, Alexandra; Januszewska, Katarzyna; Malec, Edward; Baumgartner, Helmut; Kehl, Hans-Gerd; Lammers, Astrid Elisabeth","Against all odds—late repair of multiple shunt lesions in a patient with Down syndrome: a case report","European Heart Journal - Case Reports","","2514-2119","10.1093/ehjcr/ytab234","https://academic.oup.com/ehjcr/article/doi/10.1093/ehjcr/ytab234/6323502","Abstract                            Background               Children with congenital heart defects (CHD) usually undergo elective surgical repair of haemodynamically relevant shunt lesions within the first year of life. Due to susceptibility for pulmonary arterial hypertension (PAH) in patients with Down syndrome, repair is usually aimed for no later than 6 months of life. However, with rising immigration from developing countries to Europe, more patients with unrepaired CHD are diagnosed at a later age. Anatomical repair may be precluded, when advanced pulmonary vascular disease has been established.                                         Case summary               We report a 39-month-old male patient with Down syndrome with a large non-restrictive perimembranous ventricular septal defect, a large patent ductus arteriosus, and a secundum-type atrial septal defect with a prominent left-to-right shunting. Haemodynamic assessment revealed only a mild increase of pulmonary artery pressures (mPAP) with low pulmonary vascular resistance index (PVRi). Vasodilator testing led to a further increase of the left-to-right shunt and decrease of PVRi, suggesting operability. After careful consideration, the patient underwent complete surgical repair with a good post-operative clinical outcome. Cardiac catheterization 6 months after corrective repair showed a normal mPAP. No signs of PAH have been detected in the medium-term follow-up.                                         Discussion               Expertise, increased physician awareness, and a thorough pre-operative multidisciplinary evaluation are paramount to determine the best treatment approach for patients, who may present late with multiple shunts, and—in our case—underlying Down syndrome. Long-term close post-surgical follow-up in an expert centre is warranted to promptly diagnose and treat a possible late presentation of PAH appropriately.","2021-07-01","2025-05-21 21:10:20","2025-05-21 21:10:20","2025-05-21 21:10:20","ytab234","","7","5","","","Against all odds—late repair of multiple shunt lesions in a patient with Down syndrome","","","","","","","en","http://creativecommons.org/licenses/by-nc/4.0/","","","","DOI.org (Crossref)","","","","","","","","Egorova, Anastasia; Voges, Inga; Ahmed, A Shaheer; Mukherjee, Rahul; Mehta, Vishal Shahil","","","","","","","","","","","","","","","","","","","","","","","","","","","","","","","","","","","","","","","","","","","","",""
"PXC66DUX","journalArticle","2023","Zhang, Huijun; Song, Hailong","A 1-month-old infant with pulmonary hypertensive crisis after cardiac surgery was successfully rescued with connection of left atrial and right ventricular pressure measurement tubes: a case report","European Heart Journal - Case Reports","","2514-2119","10.1093/ehjcr/ytad527","https://academic.oup.com/ehjcr/article/doi/10.1093/ehjcr/ytad527/7441582","Abstract                            Background               Pulmonary hypertensive crisis is a complication with extremely high mortality after surgery of congenital heart disease. However, there are still no treatment guidelines or expert consensus on the standard treatment of pulmonary hypertensive crisis, and the effect of conventional treatment is still unsatisfactory. We present a case of a patient who developed pulmonary hypertensive crisis after cardiac surgery, and was successfully rescued with a pioneering method, which has never been reported so far.                                         Case summary               An infant with congenital heart disease had undergone cardiac surgery successfully. Due to obvious myocardial oedema, sternal closure was delayed. The left atrial and right ventricular pressure monitoring tubes, both of which were connected through a triplet, were inserted into right pulmonary vein and pulmonary artery, respectively, and the triplet was in closed condition. On the night of the surgery, pulmonary hypertensive crisis occurred. Emergency bedside thoracotomy was given, and the triplet was turned on urgently to make the left atrial and right ventricular pressure monitoring tubes connected. Meantime, conventional treatment was performed. Eventually, the pulmonary hypertensive crisis was quickly relieved, and the infant was discharged 9 days later.                                         Discussion               The left atrial and right ventricular pressure monitoring tubes are placed intraoperatively in patients who both need delayed sternal closure and have high risk factors for pulmonary hypertensive crisis, by which could not only monitor the pressure of left atrium and right ventricle in real time but also effectively relieve the right ventricular pressure instantaneously when pulmonary hypertensive crisis occurs, as well as remedy ischaemia of systemic and coronary circulation.","2023-11-02","2025-05-21 21:10:23","2025-05-21 21:10:23","2025-05-21 21:10:23","ytad527","","11","7","","","A 1-month-old infant with pulmonary hypertensive crisis after cardiac surgery was successfully rescued with connection of left atrial and right ventricular pressure measurement tubes","","","","","","","en","https://creativecommons.org/licenses/by-nc/4.0/","","","","DOI.org (Crossref)","","","","","","","","Singh, Arvind; Wong, Ivan; Zancanaro, Edoardo; Kadioglu, Hikmet","","","","","","","","","","","","","","","","","","","","","","","","","","","","","","","","","","","","","","","","","","","","",""
"ZM7E7H9K","journalArticle","2013","El Midany, Ashraf A.H.; Mostafa, Ezzeldin A.; Azab, Sherif; Hassan, Ghada A.","Perioperative sildenafil therapy for pulmonary hypertension in infants undergoing congenital cardiac defect closure","Interactive CardioVascular and Thoracic Surgery","","1569-9293, 1569-9285","10.1093/icvts/ivt353","https://academic.oup.com/icvts/article-lookup/doi/10.1093/icvts/ivt353","","2013-12","2025-05-21 21:10:25","2025-05-21 21:10:25","2025-05-21 21:10:25","963-968","","6","17","","Interact CardioVasc Thorac Surg","","","","","","","","en","","","","","DOI.org (Crossref)","","","","/home/fgsj/Zotero/storage/THQ6B3H2/El Midany et al. - 2013 - Perioperative sildenafil therapy for pulmonary hypertension in infants undergoing congenital cardiac.pdf","","","","","","","","","","","","","","","","","","","","","","","","","","","","","","","","","","","","","","","","","","","","","","","","",""
"NB7V6GR9","journalArticle","2016","Rosic, Milenko; Susak, Stamenko; Redzek, Aleksandar; Velicki, Lazar","Closure of an atrial septal defect with a one-way flap patch in a patient with severe pulmonary hypertension","Interactive CardioVascular and Thoracic Surgery","","1569-9293, 1569-9285","10.1093/icvts/ivw032","https://academic.oup.com/icvts/article-lookup/doi/10.1093/icvts/ivw032","","2016-06","2025-05-21 21:10:29","2025-05-21 21:10:29","2025-05-21 21:10:29","856-858","","6","22","","Interact CardioVasc Thorac Surg","","","","","","","","en","","","","","DOI.org (Crossref)","","","","/home/fgsj/Zotero/storage/GQ4SIMZQ/Rosic et al. - 2016 - Closure of an atrial septal defect with a one-way flap patch in a patient with severe pulmonary hype.pdf","","","","","","","","","","","","","","","","","","","","","","","","","","","","","","","","","","","","","","","","","","","","","","","","",""
"WEDJAR7B","journalArticle","1998","Russell, Isobel A. Muhiudeen; Zwass, Maurice S.; Fineman, Jeffrey R.; Balea, Michel; Rouine-Rapp, Kathryn; Brook, Michael; Hanley, Frank L.; Silverman, Norman H.; Cahalan, Michael K.","The Effects of Inhaled Nitric Oxide on Postoperative Pulmonary Hypertension in Infants and Children Undergoing Surgical Repair of Congenital Heart Disease:","Anesthesia & Analgesia","","0003-2999","10.1097/00000539-199807000-00011","http://journals.lww.com/00000539-199807000-00011","","1998-07","2025-05-21 21:10:31","2025-05-21 21:10:31","2025-05-21 21:10:31","46-51","","1","87","","Anesthesia & Analgesia","The Effects of Inhaled Nitric Oxide on Postoperative Pulmonary Hypertension in Infants and Children Undergoing Surgical Repair of Congenital Heart Disease","","","","","","","en","","","","","DOI.org (Crossref)","","","","","","","","","","","","","","","","","","","","","","","","","","","","","","","","","","","","","","","","","","","","","","","","","","","","",""
"MDX3Q67V","journalArticle","2004","Zimmerman, Angela T; Ibsen, Laura M","Advances in postoperative care of pediatric cardiac patients:","Current Opinion in Anaesthesiology","","0952-7907","10.1097/00001503-200406000-00008","http://gateway.ovid.com/ovidweb.cgi?T=JS&amp;PAGE=crossref&amp;AN=00001503-200406000-00008","","2004-06","2025-05-21 21:10:34","2025-05-21 21:10:34","2025-05-21 21:10:34","241-246","","3","17","","Current Opinion in Anaesthesiology","Advances in postoperative care of pediatric cardiac patients","","","","","","","en","","","","","DOI.org (Crossref)","","","","","","","","","","","","","","","","","","","","","","","","","","","","","","","","","","","","","","","","","","","","","","","","","","","","",""
"JZMMEBWR","journalArticle","1997","Seghaye, Marie-Christine; Duchateau, Jean; Bruniaux, Jacqueline; Demontoux, Serge; Detruit, Helene; Bosson, Catherine; Lecronier, Gilles; Mokhfi, Emir; Serraf, Alain; Planche, Claude","Endogenous nitric oxide production and atrial natriuretic peptide biological activity in infants undergoing cardiac operations:","Critical Care Medicine","","0090-3493","10.1097/00003246-199706000-00026","http://journals.lww.com/00003246-199706000-00026","","1997-06","2025-05-21 21:10:37","2025-05-21 21:10:37","2025-05-21 21:10:37","1063-1070","","6","25","","Critical Care Medicine","Endogenous nitric oxide production and atrial natriuretic peptide biological activity in infants undergoing cardiac operations","","","","","","","en","","","","","DOI.org (Crossref)","","","","","","","","","","","","","","","","","","","","","","","","","","","","","","","","","","","","","","","","","","","","","","","","","","","","",""
"3CKPBGFP","journalArticle","2000","Morris, Kevin; Beghetti, Maurice; Petros, Andy; Adatia, Ian; Bohn, Desmond","Comparison of hyperventilation and inhaled nitric oxide for pulmonary hypertension after repair of congenital heart disease:","Critical Care Medicine","","0090-3493","10.1097/00003246-200008000-00048","http://journals.lww.com/00003246-200008000-00048","","2000-08","2025-05-21 21:10:38","2025-05-21 21:10:38","2025-05-21 21:10:38","2974-2978","","8","28","","Critical Care Medicine","Comparison of hyperventilation and inhaled nitric oxide for pulmonary hypertension after repair of congenital heart disease","","","","","","","en","","","","","DOI.org (Crossref)","","","","","","","","","","","","","","","","","","","","","","","","","","","","","","","","","","","","","","","","","","","","","","","","","","","","",""
"IA87ND9B","journalArticle","2002","Pearl, Jeffrey M.; Nelson, David P.; Raake, Jenni L.; Manning, Peter B.; Schwartz, Steven M.; Koons, Lisa; Shanley, Thomas P.; Wong, Hector R.; Duffy, Jodie Y.","Inhaled nitric oxide increases endothelin-1 levels: A potential cause of rebound pulmonary hypertension:","Critical Care Medicine","","0090-3493","10.1097/00003246-200201000-00014","http://journals.lww.com/00003246-200201000-00014","","2002-01","2025-05-21 21:10:39","2025-05-21 21:10:39","2025-05-21 21:10:39","89-93","","1","30","","Critical Care Medicine","Inhaled nitric oxide increases endothelin-1 levels","","","","","","","en","","","","","DOI.org (Crossref)","","","","","","","","","","","","","","","","","","","","","","","","","","","","","","","","","","","","","","","","","","","","","","","","","","","","",""
"SFCA8R96","journalArticle","2004","Kawakami, Hiromasa; Ichinose, Fumito","Inhaled Nitric Oxide in Pediatric Cardiac Surgery:","International Anesthesiology Clinics","","0020-5907","10.1097/00004311-200404240-00010","http://journals.lww.com/00004311-200404240-00010","","2004","2025-05-21 21:10:40","2025-05-21 21:10:40","2025-05-21 21:10:40","93-100","","4","42","","International Anesthesiology Clinics","Inhaled Nitric Oxide in Pediatric Cardiac Surgery","","","","","","","en","","","","","DOI.org (Crossref)","","","","","","","","","","","","","","","","","","","","","","","","","","","","","","","","","","","","","","","","","","","","","","","","","","","","",""
"XP4G9KPR","journalArticle","1995","Jonas, Richard A.","Advances in surgical care of infants and children with congenital heart disease:","Current Opinion in Pediatrics","","1040-8703","10.1097/00008480-199510000-00014","http://journals.lww.com/00008480-199510000-00014","","1995-10","2025-05-21 21:10:41","2025-05-21 21:10:41","2025-05-21 21:10:41","572-579","","5","7","","Current Opinion in Pediatrics","Advances in surgical care of infants and children with congenital heart disease","","","","","","","en","","","","","DOI.org (Crossref)","","","","","","","","","","","","","","","","","","","","","","","","","","","","","","","","","","","","","","","","","","","","","","","","","","","","",""
"U8N4UQGH","journalArticle","2000","Chang, Anthony C.","Pediatric cardiac intensive care: current state of the art and beyond the millennium:","Current Opinion in Pediatrics","","1040-8703","10.1097/00008480-200006000-00011","http://journals.lww.com/00008480-200006000-00011","","2000-06","2025-05-21 21:10:42","2025-05-21 21:10:42","2025-05-21 21:10:42","238-246","","3","12","","Current Opinion in Pediatrics","Pediatric cardiac intensive care","","","","","","","en","","","","","DOI.org (Crossref)","","","","","","","","","","","","","","","","","","","","","","","","","","","","","","","","","","","","","","","","","","","","","","","","","","","","",""
"E95ME8KH","journalArticle","2003","Ravishankar, Chitra; Tabbutt, Sarah; Wernovsky, Gil","Critical care in cardiovascular medicine:","Current Opinion in Pediatrics","","1040-8703","10.1097/00008480-200310000-00001","http://journals.lww.com/00008480-200310000-00001","","2003-10","2025-05-21 21:10:43","2025-05-21 21:10:43","2025-05-21 21:10:43","443-453","","5","15","","Current Opinion in Pediatrics","Critical care in cardiovascular medicine","","","","","","","en","","","","","DOI.org (Crossref)","","","","","","","","","","","","","","","","","","","","","","","","","","","","","","","","","","","","","","","","","","","","","","","","","","","","",""
"YBFFG53B","journalArticle","2006","Wu, Kai-hong; Lü, Xiao-dong; Liu, Ying-long","Recent progress of pediatric cardiac surgery in China:","Chinese Medical Journal","","0366-6999","10.1097/00029330-200612010-00011","http://journals.lww.com/00029330-200612010-00011","","2006-12","2025-05-21 21:10:44","2025-05-21 21:10:44","2025-05-21 21:10:44","2005-2012","","23","119","","Chinese Medical Journal","Recent progress of pediatric cardiac surgery in China","","","","","","","en","","","","","DOI.org (Crossref)","","","","","","","","","","","","","","","","","","","","","","","","","","","","","","","","","","","","","","","","","","","","","","","","","","","","",""
"PYP8ZUZA","journalArticle","2007","Ryan, Angela; Tobias, Joseph D","A 5-Year Survey of Nitric Oxide Use in a Pediatric Intensive Care Unit","American Journal of Therapeutics","","1075-2765","10.1097/01.mjt.0000183567.13876.d7","https://journals.lww.com/00045391-200705000-00007","","2007-05","2025-05-21 21:10:48","2025-05-21 21:10:48","2025-05-21 21:10:48","253-258","","3","14","","","","","","","","","","en","","","","","DOI.org (Crossref)","","","","","","","","","","","","","","","","","","","","","","","","","","","","","","","","","","","","","","","","","","","","","","","","","","","","",""
"X2R8Q69W","journalArticle","2004","Kageyama, Kyoko; Shime, Nobuaki; Hirose, Munetaka; Hiramatsu, Noriko; Ashida, Hiromi; Hashimoto, Satoru","Factors contributing to successful discontinuation from inhaled nitric oxide therapy in pediatric patients after congenital cardiac surgery:","Pediatric Critical Care Medicine","","1529-7535","10.1097/01.PCC.0000128605.00726.01","http://journals.lww.com/00130478-200407000-00005","","2004-07","2025-05-21 21:10:49","2025-05-21 21:10:49","2025-05-21 21:10:49","351-355","","4","5","","Pediatric Critical Care Medicine","Factors contributing to successful discontinuation from inhaled nitric oxide therapy in pediatric patients after congenital cardiac surgery","","","","","","","en","","","","","DOI.org (Crossref)","","","","","","","","","","","","","","","","","","","","","","","","","","","","","","","","","","","","","","","","","","","","","","","","","","","","",""
"K4RBU369","journalArticle","2013","Axelrod, David M.; Klugman, Darren; Wright, Gail E.; Chang, Anthony; Bronicki, Ronald; Roth, Stephen J.","One Hundred Useful References in Pediatric Cardiac Intensive Care: The 2012 Update","Pediatric Critical Care Medicine","","1529-7535","10.1097/01.PCC.0000434621.25332.71","http://journals.lww.com/00130478-201310000-00006","","2013-10","2025-05-21 21:10:51","2025-05-21 21:10:51","2025-05-21 21:10:51","770-785","","8","14","","Pediatric Critical Care Medicine","One Hundred Useful References in Pediatric Cardiac Intensive Care","","","","","","","en","","","","","DOI.org (Crossref)","","","","","","","","","","","","","","","","","","","","","","","","","","","","","","","","","","","","","","","","","","","","","","","","","","","","",""
"XFHCNHV9","journalArticle","2011","Bronicki, Ronald A.; Chang, Anthony C.","Management of the postoperative pediatric cardiac surgical patient:","Critical Care Medicine","","0090-3493","10.1097/CCM.0b013e31821b82a6","http://journals.lww.com/00003246-201108000-00016","","2011-08","2025-05-21 21:10:52","2025-05-21 21:10:52","2025-05-21 21:10:52","1974-1984","","8","39","","Critical Care Medicine","Management of the postoperative pediatric cardiac surgical patient","","","","","","","en","","","","","DOI.org (Crossref)","","","","","","","","","","","","","","","","","","","","","","","","","","","","","","","","","","","","","","","","","","","","","","","","","","","","",""
"JL6M52S5","journalArticle","2018","Brown, Georgia; Humpl, Tilman","Approach to pulmonary vascular disease in the ICU","Current Opinion in Pediatrics","","1040-8703, 1531-698X","10.1097/MOP.0000000000000626","https://journals.lww.com/00008480-201806000-00003","Purpose of review               Pulmonary vascular disease (PVD) complicates the course of many cardiovascular, pulmonary and other systemic diseases in children. The physiological sequelae (pulmonary hypertension and elevated pulmonary vascular resistance) can overwhelm the right ventricle and lead to circulatory collapse. Despite the common end-point, the preceding pathophysiology is complex and variable and requires a tailored approach to diagnosis and management. In this article, we will review the most recent evidence and explore an approach to current controversies in the diagnosis and management of common or challenging patient subgroups.                                         Recent findings               New methods of interpreting data derived from echocardiography and cardiac magnetic resonance imaging may assist in risk stratification and response to therapy. In specific patient subgroups, standard pharmacological therapies to reduce right ventricle afterload may be overutilized, ineffective and in some cases harmful. In the patient failing pharmacological therapy, new and novel techniques are being explored including temporary extracorporeal mechanical circulatory support, pumpless lung assist devices and novel surgical and catheterization procedures.                                         Summary               PVD is a diverse entity, and attention to the underlying pathophysiology is essential for appropriate management. Despite significant advances in our understanding, the majority of data comes from small uncontrolled studies and must be interpreted with caution.","2018-06","2025-05-21 21:10:53","2025-05-21 21:10:53","2025-05-21 21:10:53","326-331","","3","30","","","","","","","","","","en","","","","","DOI.org (Crossref)","","","","","","","","","","","","","","","","","","","","","","","","","","","","","","","","","","","","","","","","","","","","","","","","","","","","",""
