"2JU5RNIW","journalArticle","2003","Schulze-Neick, Ingram; Hartenstein, Paulina; Li, Jia; Stiller, Brigitte; Nagdyman, Nicole; Hübler, Michael; Butrous, Ghazwan; Petros, Andy; Lange, Peter; Redington, Andrew N.","Intravenous Sildenafil Is a Potent Pulmonary Vasodilator in Children With Congenital Heart Disease","Circulation","","0009-7322, 1524-4539","10.1161/01.cir.0000087384.76615.60","https://www.ahajournals.org/doi/10.1161/01.cir.0000087384.76615.60","Background—                              Increased pulmonary vascular resistance (PVR) because of congenital heart disease (CHD) may be caused by a dysfunction in endogenous pulmonary endothelial nitric oxide (NO) production. In other forms of pulmonary vascular disease with increased PVR, an elevated activity of a phosphodiesterase type 5 (PDE-5), responsible for the degradation of cyclic guanidine monophosphate (cGMP), the second messenger of endothelially produced NO, has been demonstrated. This study compares the effects of inhaled NO before and after the specific inhibition of the PDE-5 by intravenous sildenafil (Viagra™) in pre- and postoperative children with increased PVR because of CHD.                                                          Methods and Results—                              12 children with congenital heart disease (age 0.2 to 15.7 years, median 2.4 years) and increased mean pulmonary arterial pressure, and 12 postoperative children (age 0.11 to 0.65 years, median 0.32 years) with increased PVR (8.3±1.0 Wood Units*m               2               ) were studied during cardiac catheterization (“cath laboratory”), or within 2 hours after return from cardiac surgery (“post op”), respectively. All were sedated, tracheally intubated and paralyzed. During alveolar hyperoxygenation (F               i               O               2               =0.65), the effects of inhaled NO (20 ppm) were compared before and after the stepwise infusion of sildenafil (“cath laboratory”, 1 mg/kg; post op, 0.25 mg/kg). Intravenous sildenafil more effectively reduced PVR than NO (11.5% versus 4.3% in the “cath laboratory” patient group,               P               <0.05, and 25.8% versus 14.6% in the post op patient group,               P               =0.09. The increase in cGMP in response to NO was potentiated (2- to 2.4-fold) by PDE-5 inhibition. While the vasodilating effects of sildenafil showed pulmonary selectivity, its infusion was associated with increased intrapulmonary shunting in the postoperative patients (Q               s               /Q               t               =16.5±4.7% to 25.5±18.2%               P               =0.04).                                                          Conclusions—                              Intravenous sildenafil is as effective as inhaled NO as a pulmonary vasodilator in children with congenital heart disease. Although clinically insignificant in this study, increased intrapulmonary shunting with sildenafil may be disadvantageous in some patients after CHD surgery.","2003-09-09","2025-05-21 21:11:53","2025-05-21 21:11:53","2025-05-21 21:11:53","","","10_suppl_1","108","","Circulation","","","","","","","","en","","","","","DOI.org (Crossref)","","","","/home/fgsj/Zotero/storage/7C9JZLDX/Schulze-Neick et al. - 2003 - Intravenous Sildenafil Is a Potent Pulmonary Vasodilator in Children With Congenital Heart Disease.pdf","","","","","","","","","","","","","","","","","","","","","","","","","","","","","","","","","","","","","","","","","","","","","","","","",""
"H4CNHP9K","journalArticle","1999","Schulze-Neick, Ingram; Penny, Daniel J.; Rigby, Michael L.; Morgan, Cliff; Kelleher, Andrea; Collins, Peter; Li, Jia; Bush, Andrew; Shinebourne, Elliot A.; Redington, Andrew N.","L-Arginine and Substance P Reverse the Pulmonary Endothelial Dysfunction Caused by Congenital Heart Surgery","Circulation","","0009-7322, 1524-4539","10.1161/01.CIR.100.7.749","https://www.ahajournals.org/doi/10.1161/01.CIR.100.7.749","Background               —The increase in pulmonary vascular resistance (PVR) seen in children after cardiopulmonary bypass has been attributed to transient pulmonary endothelial dysfunction (PED). We therefore examined PED in children with congenital heart disease by assessing the               l               -arginine–nitric oxide (NO) pathway in terms of substrate supplementation (               l               -arginine [L-Arg]), stimulation of endogenous NO release (substance P [Sub-P]), and end-product provision (inhaled NO) before and after open heart surgery.                                         Methods and Results               —Ten patients (aged 0.62±0.27 years) with pulmonary hypertension undergoing cardiac catheterization who had not had surgery and 10 patients (aged 0.65±0.73 years) who had recently undergone cardiopulmonary bypass were examined. All were sedated and paralyzed and received positive-pressure ventilation. Blood samples and pressure measurements were taken from catheters in the pulmonary artery and the pulmonary vein or left atrium. Respiratory mass spectrometry was used to measure oxygen uptake, and cardiac output was determined by the direct Fick method. PVR was calculated during steady state at ventilation with room air, during F               io               2               of 0.65, then during additional intravenous infusion of L-Arg (15 mg · kg               −1               · min               −1               ) and Sub-P (1 pmol · kg               −1               · min               −1               ), and finally during inhalation of NO (20 ppm). In preoperative patients, the lack of an additional significant change of PVR with L-Arg, Sub-P, and inhaled NO suggests little preexisting PED. Postoperative PVR was higher, with an additional pulmonary endothelial contribution that was restorable with L-Arg and Sub-P.                                         Conclusions               —Postoperatively, the rise in PVR suggested PED, which was restorable by L-Arg and Sub-P, with no additional effect of inhaled NO. These results may indicate important new treatment strategies for these patients.","1999-08-17","2025-05-21 21:11:56","2025-05-22 11:30:04","2025-05-21 21:11:56","749-755","","7","100","","Circulation","<span style=""font-variant","","","","","","","en","","","","","DOI.org (Crossref)","","","","/home/fgsj/Zotero/storage/LNETX9CH/Schulze-Neick et al. - 1999 - l -Arginine and Substance P Reverse the Pulmonary Endo.pdf","","","","","","","","","","","","","","","","","","","","","","","","","","","","","","","","","","","","","","","","","","","","","","","","",""
"3QVSKBXC","journalArticle","2000","McMullan, D. M.; Bekker, J. M.; Parry, A. J.; Johengen, M. J.; Kon, A.; Heidersbach, R. S.; Black, S. M.; Fineman, J. R.","Alterations in Endogenous Nitric Oxide Production After Cardiopulmonary Bypass in Lambs With Normal and Increased Pulmonary Blood Flow","Circulation","","0009-7322, 1524-4539","10.1161/01.CIR.102.suppl_3.III-172","http://circ.ahajournals.org/cgi/doi/10.1161/01.CIR.102.suppl_3.III-172","","2000-11-07","2025-05-21 21:11:59","2025-05-21 21:11:59","2025-05-21 21:11:59","III-172-III-178","","Supplement 3","102","","Circulation","","","","","","","","en","","","","","DOI.org (Crossref)","","","","","","","","","","","","","","","","","","","","","","","","","","","","","","","","","","","","","","","","","","","","","","","","","","","","",""
"I53T9XHX","journalArticle","1993","Wessel, D L; Adatia, I; Giglia, T M; Thompson, J E; Kulik, T J","Use of inhaled nitric oxide and acetylcholine in the evaluation of pulmonary hypertension and endothelial function after cardiopulmonary bypass.","Circulation","","0009-7322, 1524-4539","10.1161/01.CIR.88.5.2128","https://www.ahajournals.org/doi/10.1161/01.CIR.88.5.2128","BACKGROUND               Increased pulmonary vascular resistance is common in congenital heart disease and is exacerbated by cardiopulmonary bypass (CPB). We investigated whether CPB is responsible for pulmonary endothelial dysfunction and contributes to postoperative pulmonary hypertension.                                         METHODS AND RESULTS               We infused the endothelium-dependent vasodilator acetylcholine (ACH) into the pulmonary circulation of pulmonary hypertensive children with congenital heart disease either before (n = 12) or after (n = 22) surgical repair on CPB. The dose response to ACH (10(-9) to 10(-6) M) was recorded for all hemodynamic variables. Nine additional postoperative patients were studied with ACH followed by inhalation of 80 ppm nitric oxide, an endothelium-independent smooth muscle relaxant. Plasma levels of cyclic GMP (cGMP) were measured before and after ACH and nitric oxide administration. Pulmonary vasodilation with 10(-6) M ACH was seen in all preoperative patients but was markedly attenuated in postoperative patients. Baseline pulmonary vascular resistance (5.6 +/- 1.0 U x m2) fell 46 +/- 5% in preoperative patients but declined only 11 +/- 4% from baseline (5.8 +/- 0.9 U x m2) in postoperative patients (P < .002). However, inhalation of 80 ppm nitric oxide after ACH infusion in postoperative patients lowered pulmonary vascular resistance by 33 +/- 4% (P < .0002 compared with postoperative ACH response) with minimal effects on the systemic circulation. This finding suggests that the capacity for smooth muscle relaxation and pulmonary vasodilation was present in postoperative patients but could not be induced by ACH. Plasma levels of cGMP in postoperative patients were unchanged after acetylcholine infusion but rose more than threefold during pulmonary vasodilation with nitric oxide (P < .0001). This finding is consistent with the purported role of cGMP as the second messenger effecting smooth muscle relaxation in this process.                                         CONCLUSIONS               CPB may be responsible for postoperative dysfunction of the pulmonary endothelial cell and may contribute to postoperative pulmonary hypertension in children. Inhaled nitric oxide is a potent pulmonary vasodilator after CPB with minimal systemic circulatory effects. It may have important diagnostic and therapeutic applications in patients with congenital heart disease.","1993-11","2025-05-21 21:12:00","2025-05-21 21:12:00","2025-05-21 21:12:00","2128-2138","","5","88","","Circulation","","","","","","","","en","","","","","DOI.org (Crossref)","","","","","","","","","","","","","","","","","","","","","","","","","","","","","","","","","","","","","","","","","","","","","","","","","","","","",""
"LE3S7FSC","journalArticle","2023","Ghadimi, Kamrouz; Cappiello, Jhaymie L.; Wright, Mary Cooter; Levy, Jerrold H.; Bryner, Benjamin S.; DeVore, Adam D.; Schroder, Jacob N.; Patel, Chetan B.; Rajagopal, Sudarshan; Shah, Svati H.; Milano, Carmelo A.; for the INSPIRE-FLO Investigators","Inhaled Epoprostenol Compared With Nitric Oxide for Right Ventricular Support After Major Cardiac Surgery","Circulation","","0009-7322, 1524-4539","10.1161/CIRCULATIONAHA.122.062464","https://www.ahajournals.org/doi/10.1161/CIRCULATIONAHA.122.062464","BACKGROUND:               Right ventricular failure (RVF) is a leading driver of morbidity and death after major cardiac surgery for advanced heart failure, including orthotopic heart transplantation and left ventricular assist device implantation. Inhaled pulmonary-selective vasodilators, such as inhaled epoprostenol (iEPO) and nitric oxide (iNO), are essential therapeutics for the prevention and medical management of postoperative RVF. However, there is limited evidence from clinical trials to guide agent selection despite the significant cost considerations of iNO therapy.                                         METHODS:               In this double-blind trial, participants were stratified by assigned surgery and key preoperative prognostic features, then randomized to continuously receive either iEPO or iNO beginning at the time of separation from cardiopulmonary bypass with the continuation of treatment into the intensive care unit stay. The primary outcome was the composite RVF rate after both operations, defined after transplantation by the initiation of mechanical circulatory support for isolated RVF, and defined after left ventricular assist device implantation by moderate or severe right heart failure according to criteria from the Interagency Registry for Mechanically Assisted Circulatory Support. An equivalence margin of 15 percentage points was prespecified for between-group RVF risk difference. Secondary postoperative outcomes were assessed for treatment differences and included: mechanical ventilation duration; hospital and intensive care unit length of stay during the index hospitalization; acute kidney injury development including renal replacement therapy initiation; and death at 30 days, 90 days, and 1 year after surgery.                                         RESULTS:               Of 231 randomized participants who met eligibility at the time of surgery, 120 received iEPO, and 111 received iNO. Primary outcome occurred in 30 participants (25.0%) in the iEPO group and 25 participants (22.5%) in the iNO group, for a risk difference of 2.5 percentage points (two one-sided test 90% CI, –6.6% to 11.6%) in support of equivalence. There were no significant between-group differences for any of the measured postoperative secondary outcomes.                                         CONCLUSIONS:               Among patients undergoing major cardiac surgery for advanced heart failure, inhaled pulmonary-selective vasodilator treatment using iEPO was associated with similar risks for RVF development and development of other postoperative secondary outcomes compared with treatment using iNO.                                         REGISTRATION:                                URL:                 https://www.clinicaltrials.gov                 ; Unique identifier: NCT03081052.","2023-10-24","2025-05-21 21:12:01","2025-05-21 21:12:01","2025-05-21 21:12:01","1316-1329","","17","148","","Circulation","","","","","","","","en","","","","","DOI.org (Crossref)","","","","","","","","","","","","","","","","","","","","","","","","","","","","","","","","","","","","","","","","","","","","","","","","","","","","",""
"G57TCI4N","journalArticle","1997","Duke, Trevor; South, Mike; Stewart, Alastair","Altered activation of the L-arginine nitric oxide pathway during and after cardiopulmonary bypass","Perfusion","","0267-6591, 1477-111X","10.1177/026765919701200609","https://journals.sagepub.com/doi/10.1177/026765919701200609","The serum concentrations of nitrogen oxides, the stable metabolites of nitric oxide, were measured in 61 children during and after cardiopulmonary bypass (CPB) for surgery of congenital heart disease. Overall, there was a small reduction in serum nitrogen oxide concentrations during CPB, from a median of 27.5 (interquartile range 16.6-55.7) to 26.4 (15.3-40.6) μmol/l, followed by an increase in the following 24 h to 33.1 (21.3-46.7) μmol/l. The largest postoperative increases in nitrogen oxides occurred in children who developed renal impairment, or were treated with nitrovasodilators. There was no relationship between changes in serum nitrogen oxides intraoperatively and early changes in pulmonary vascular resistance, and a weak positive relationship between changes in serum nitrogen oxides and early postoperative changes in cardiac index ( r               2               = 0.09, p = 0.04). We found no evidence for increased activation of the L-arginine nitric oxide pathway during CPB; and the reduction in nitric oxide metabolites that occurred during CPB were of doubtful significance to pulmonary or systemic haemodynamic changes in the postoperative period.","1997-12","2025-05-21 21:12:04","2025-05-21 21:12:04","2025-05-21 21:12:04","405-410","","6","12","","Perfusion","","","","","","","","en","https://journals.sagepub.com/page/policies/text-and-data-mining-license","","","","DOI.org (Crossref)","","","","","","","","","","","","","","","","","","","","","","","","","","","","","","","","","","","","","","","","","","","","","","","","","","","","",""
"ZXHDZSBI","journalArticle","2008","Lee, Jaclyn E.; Hillier, Simon C.; Knoderer, Chad A.","Use of Sildenafil to Facilitate Weaning From Inhaled Nitric Oxide in Children With Pulmonary Hypertension Following Surgery for Congenital Heart Disease","Journal of Intensive Care Medicine","","0885-0666, 1525-1489","10.1177/0885066608321389","https://journals.sagepub.com/doi/10.1177/0885066608321389","Pulmonary hypertension frequently complicates the postoperative management of patients after congenital cardiac surgery. Inhaled nitric oxide is an effective treatment option, but rebound pulmonary hypertension can occur upon its withdrawal. Sildenafil may facilitate its withdrawal by restoring cyclic guanosine monophosphate availability via phosphodiesterase-5 inhibition. The purpose of this study was to evaluate the use of sildenafil in facilitating weaning from inhaled nitric oxide after congenital cardiac surgery in patients who had previously failed weaning, and to compare the effects of sildenafil on pulmonary and systemic hemodynamics. Children who received sildenafil after cardiovascular surgery during a 23-month period at Riley Hospital for Children were identified. Medical records were retrospectively reviewed to determine sildenafil and nitric oxide dosing, pulmonary and systemic blood pressures, and adverse effects. Oral sildenafil was administered to 7 children who had failed attempts at inhaled nitric oxide weaning. Inhaled nitric oxide was weaned from 29.8 ± 5.9 ppm prior to sildenafil initiation to 12.2 ± 3.4 ppm (mean ± SE; P = .024) in the 24 hours after sildenafil. Mean pulmonary artery and systemic arterial pressure were unchanged from baseline when measured 1 hour after sildenafil dosing (mean pulmonary artery pressure, 29 ± 1 to 27 ± 0.7 mm Hg, P = .066; mean systemic arterial pressure, 56 ± 1.2 to 54 ± 1.2 mm Hg, P = .202). Sildenafil may facilitate withdrawal of inhaled nitric oxide and prevent rebound pulmonary hypertension in patients previously failing inhaled nitric oxide weaning attempts.","2008-09","2025-05-21 21:12:05","2025-05-21 21:12:05","2025-05-21 21:12:05","329-334","","5","23","","J Intensive Care Med","","","","","","","","en","https://journals.sagepub.com/page/policies/text-and-data-mining-license","","","","DOI.org (Crossref)","","","","","","","","","","","","","","","","","","","","","","","","","","","","","","","","","","","","","","","","","","","","","","","","","","","","",""
"JTKWTTQV","journalArticle","2017","Ross, Faith J.; Joffe, Denise; Latham, Gregory J.","Perioperative and Anesthetic Considerations in Total Anomalous Pulmonary Venous Connection","Seminars in Cardiothoracic and Vascular Anesthesia","","1089-2532, 1940-5596","10.1177/1089253216672012","https://journals.sagepub.com/doi/10.1177/1089253216672012","Total anomalous pulmonary venous connection (TAPVC) is a potentially devastating form of congenital heart disease in which all pulmonary blood flow returns to the systemic venous circulation rather than the left atrium. Anomalous pulmonary venous flow may be obstructed at birth, and affected infants present with severe cyanosis and poor cardiac output unresponsive to standard resuscitation with prostaglandin. Obstructed TAPVC remains one of the few indications for emergent neonatal cardiac surgery. This review will discuss the physiology and perioperative management of isolated TAPVC without associated cardiac lesions.","2017-06","2025-05-21 21:12:07","2025-05-21 21:12:07","2025-05-21 21:12:07","138-144","","2","21","","Semin Cardiothorac Vasc Anesth","","","","","","","","en","","","","","DOI.org (Crossref)","","","","","","","","","","","","","","","","","","","","","","","","","","","","","","","","","","","","","","","","","","","","","","","","","","","","",""
"BNSWWUVQ","journalArticle","2018","Bernier, Meghan L.; Jacob, Ariel I.; Collaco, Joseph M.; McGrath‐Morrow, Sharon A.; Romer, Lewis H; Unegbu, Chinwe C.","Perioperative events in children with pulmonary hypertension undergoing non‐cardiac procedures","Pulmonary Circulation","","2045-8940, 2045-8940","10.1177/2045893217738143","https://onlinelibrary.wiley.com/doi/10.1177/2045893217738143","Prior limited research indicates that children with pulmonary hypertension (PH) have higher rates of adverse perioperative outcomes when undergoing non‐cardiac procedures and cardiac catheterizations. We examined a single‐center retrospective cohort of children with active or pharmacologically controlled PH who underwent cardiac catheterization or non‐cardiac surgery during 2006–2014. Preoperative characteristics and perioperative courses were examined to determine relationships between the severity or etiology of PH, type of procedure, and occurrence of major and minor events. We identified 77 patients who underwent 148 procedures at a median age of six months. The most common PH etiologies were bronchopulmonary dysplasia (46.7%), congenital heart disease (29.9%), and congenital diaphragmatic hernia (14.3%). Cardiac catheterizations (39.2%), and abdominal (29.1%) and central venous access (8.9%) were the most common procedures. Major events included failed planned extubation (5.6%), postoperative cardiac arrest (4.7%), induction or intraoperative cardiac arrest (2%), and postoperative death (1.4%). Major events were more frequent in patients with severe baseline PH (               P                = 0.006) and the incidence was associated with procedure type (               P                = 0.05). Preoperative inhaled nitric oxide and prostacyclin analog therapies were associated with decreased incidence of minor events (odds ratio [OR] = 0.32,               P                = 0.046 and OR = 0.24,               P                = 0.008, respectively), but no change in the incidence of major events. PH etiology was not associated with events (               P                = 0.24). Children with PH have increased risk of perioperative complications; cardiac arrest and death occur more frequently in patients with severe PH and those undergoing thoracic procedures. Risk may be modified by using preoperative pulmonary vasodilator therapy and lends itself to further prospective studies.","2018-01","2025-05-21 21:12:08","2025-05-21 21:12:08","2025-05-21 21:12:08","1-10","","1","8","","Pulm. circ.","","","","","","","","en","http://creativecommons.org/licenses/by-nc/4.0/","","","","DOI.org (Crossref)","","","","/home/fgsj/Zotero/storage/7QE45U69/Bernier et al. - 2018 - Perioperative events in children with pulmonary hypertension undergoing non‐cardiac procedures.pdf","","","","","","","","","","","","","","","","","","","","","","","","","","","","","","","","","","","","","","","","","","","","","","","","",""
