"BKC4WB8Y","journalArticle","2011","Pan, Xiangbin; Zheng, Zhe; Hu, Shengshou; Li, Shoujun; Wei, Yingjie; Zhang, Yajuan; Cheng, Xiansheng; Ma, Kai","Mechanisms of Pulmonary Hypertension Related to Ventricular Septal Defect in Congenital Heart Disease","The Annals of Thoracic Surgery","","00034975","10.1016/j.athoracsur.2011.07.051","https://linkinghub.elsevier.com/retrieve/pii/S0003497511018133","","2011-12","2025-05-21 21:07:21","2025-05-21 21:07:21","2025-05-21 21:07:21","2215-2220","","6","92","","The Annals of Thoracic Surgery","","","","","","","","en","https://www.elsevier.com/tdm/userlicense/1.0/","","","","DOI.org (Crossref)","","","","","","","","","","","","","","","","","","","","","","","","","","","","","","","","","","","","","","","","","","","","","","","","","","","","",""
"J3UXJYGV","journalArticle","2013","Ofori-Amanfo, George; Cheifetz, Ira M.","Pediatric Postoperative Cardiac Care","Critical Care Clinics","","07490704","10.1016/j.ccc.2013.01.003","https://linkinghub.elsevier.com/retrieve/pii/S0749070413000043","","2013-04","2025-05-21 21:07:22","2025-05-21 21:07:22","2025-05-21 21:07:22","185-202","","2","29","","Critical Care Clinics","","","","","","","","en","https://www.elsevier.com/tdm/userlicense/1.0/","","","","DOI.org (Crossref)","","","","","","","","","","","","","","","","","","","","","","","","","","","","","","","","","","","","","","","","","","","","","","","","","","","","",""
"UUA962LY","journalArticle","2020","Ashkanase, Jenna; Nama, Nassr; Sandarage, Ryan Vimukthie; Penslar, Joshua; Gupta, Ronish; Ly, Sophia; Wan, Melissa; Tsang, Phillip; Nantsios, Alex; Jacques, Erik; Yang, Hsin Yun; Tsang, Conrad Ian; Mazhar, Hajra; Xu, Gang; Rodriguez, Maria; Gerber, Samantha; Laird, Laurie M.; Sampson, Margaret; Wong, Derek T.; McNally, James D.","Identification and Evaluation of Controlled Trials in Pediatric Cardiology: Crowdsourced Scoping Review and Creation of Accessible Searchable Database","Canadian Journal of Cardiology","","0828282X","10.1016/j.cjca.2020.01.028","https://linkinghub.elsevier.com/retrieve/pii/S0828282X20301744","","2020-11","2025-05-21 21:07:26","2025-05-21 21:07:26","2025-05-21 21:07:26","1795-1804","","11","36","","Canadian Journal of Cardiology","Identification and Evaluation of Controlled Trials in Pediatric Cardiology","","","","","","","en","","","","","DOI.org (Crossref)","","","","","","","","","","","","","","","","","","","","","","","","","","","","","","","","","","","","","","","","","","","","","","","","","","","","",""
"35Y9NL9G","journalArticle","2020","Hascoet, Sébastien; Boet, Angèle; Roussin, Régine; Guihaire, Julien; Savale, Laurent; Mercier, Olaf; Fadel, Elie","Pumpless Lung Assist as a Bridge to Medical Therapy in a Teenager With Pulmonary Arterial Hypertension and Partial Anomalous Pulmonary Venous Return","Canadian Journal of Cardiology","","0828282X","10.1016/j.cjca.2020.06.001","https://linkinghub.elsevier.com/retrieve/pii/S0828282X20305195","","2020-11","2025-05-21 21:07:27","2025-05-21 21:07:27","2025-05-21 21:07:27","1831.e7-1831.e9","","11","36","","Canadian Journal of Cardiology","","","","","","","","en","","","","","DOI.org (Crossref)","","","","","","","","","","","","","","","","","","","","","","","","","","","","","","","","","","","","","","","","","","","","","","","","","","","","",""
"CLS9NUYY","journalArticle","2006","Hosseinpour, A; Cullen, S; Tsang, V","Transplantation for adults with congenital heart disease☆","European Journal of Cardio-Thoracic Surgery","","10107940","10.1016/j.ejcts.2006.06.007","https://academic.oup.com/ejcts/article-lookup/doi/10.1016/j.ejcts.2006.06.007","","2006-09","2025-05-21 21:07:33","2025-05-21 21:07:33","2025-05-21 21:07:33","508-514","","3","30","","European Journal of Cardio-Thoracic Surgery","","","","","","","","en","","","","","DOI.org (Crossref)","","","","","","","","","","","","","","","","","","","","","","","","","","","","","","","","","","","","","","","","","","","","","","","","","","","","",""
"PKK7BLQA","journalArticle","2010","Nemoto, Shintaro; Sasaki, Tomoyasu; Ozawa, Hideki; Katsumata, Takahiro; Kishi, Kanta; Okumura, Kenichi; Mori, Yasuhiko; Umegaki, Osamu","Oral sildenafil for persistent pulmonary hypertension early after congenital cardiac surgery in children☆","European Journal of Cardio-Thoracic Surgery","","10107940","10.1016/j.ejcts.2010.01.045","https://academic.oup.com/ejcts/article-lookup/doi/10.1016/j.ejcts.2010.01.045","","2010-07","2025-05-21 21:07:34","2025-05-21 21:07:34","2025-05-21 21:07:34","71-77","","1","38","","European Journal of Cardio-Thoracic Surgery","","","","","","","","en","","","","","DOI.org (Crossref)","","","","","","","","","","","","","","","","","","","","","","","","","","","","","","","","","","","","","","","","","","","","","","","","","","","","",""
"F8YXKAZZ","journalArticle","2005","Barr, Mark L.; Kawut, Steven M.; Whelan, Timothy P.; Girgis, Reda; Böttcher, Heidi; Sonett, Joshua; Vigneswaran, Wickii; Follette, David M.; Corris, Paul A.","Report of the ISHLT Working Group on Primary Lung Graft Dysfunction Part IV: Recipient-Related Risk Factors and Markers","The Journal of Heart and Lung Transplantation","","10532498","10.1016/j.healun.2005.02.019","https://linkinghub.elsevier.com/retrieve/pii/S1053249805001361","","2005-10","2025-05-21 21:07:35","2025-05-21 21:07:35","2025-05-21 21:07:35","1468-1482","","10","24","","The Journal of Heart and Lung Transplantation","Report of the ISHLT Working Group on Primary Lung Graft Dysfunction Part IV","","","","","","","en","https://www.elsevier.com/tdm/userlicense/1.0/","","","","DOI.org (Crossref)","","","","/home/fgsj/Zotero/storage/63C9GR5Q/Barr et al. - 2005 - Report of the ISHLT Working Group on Primary Lung Graft Dysfunction Part IV Recipient-Related Risk.pdf","","","","","","","","","","","","","","","","","","","","","","","","","","","","","","","","","","","","","","","","","","","","","","","","",""
"SE65KSZH","journalArticle","2015","Chiu, Joanne S.; Zuckerman, Warren A.; Turner, Mariel E.; Richmond, Marc E.; Kerstein, Diane; Krishnan, Usha; Torres, Alejandro; Vincent, Julie A.; Rosenzweig, Erika B.","Balloon atrial septostomy in pulmonary arterial hypertension: Effect on survival and associated outcomes","The Journal of Heart and Lung Transplantation","","10532498","10.1016/j.healun.2015.01.004","https://linkinghub.elsevier.com/retrieve/pii/S1053249815000066","","2015-03","2025-05-21 21:07:38","2025-05-21 21:07:38","2025-05-21 21:07:38","376-380","","3","34","","The Journal of Heart and Lung Transplantation","Balloon atrial septostomy in pulmonary arterial hypertension","","","","","","","en","","","","","DOI.org (Crossref)","","","","/home/fgsj/Zotero/storage/SATNY7QD/Chiu et al. - 2015 - Balloon atrial septostomy in pulmonary arterial hypertension Effect on survival and associated outc.pdf","","","","","","","","","","","","","","","","","","","","","","","","","","","","","","","","","","","","","","","","","","","","","","","","",""
"CADVEZAT","journalArticle","2008","Limsuwan, Alisa; Wanitkul, Suthep; Khosithset, Anant; Attanavanich, Sukasom; Samankatiwat, Piya","Aerosolized iloprost for postoperative pulmonary hypertensive crisis in children with congenital heart disease","International Journal of Cardiology","","01675273","10.1016/j.ijcard.2007.08.084","https://linkinghub.elsevier.com/retrieve/pii/S0167527307017986","","2008-10","2025-05-21 21:07:41","2025-05-21 21:07:41","2025-05-21 21:07:41","333-338","","3","129","","International Journal of Cardiology","","","","","","","","en","https://www.elsevier.com/tdm/userlicense/1.0/","","","","DOI.org (Crossref)","","","","","","","","","","","","","","","","","","","","","","","","","","","","","","","","","","","","","","","","","","","","","","","","","","","","",""
"8FA6XUHK","journalArticle","2024","Thuan, Phan Quang; Chuong, Pham Tran Viet; Thang, Ho Duc; Nhiem, Dinh Long; Nam, Nguyen Hoai; Dinh, Nguyen Hoang","Successful surgical management of large pulmonary artery thrombosis in a patient with primary severe mitral regurgitation and complex congenital heart disease: A case report","International Journal of Surgery Case Reports","","22102612","10.1016/j.ijscr.2023.109159","https://linkinghub.elsevier.com/retrieve/pii/S2210261223012889","","2024-01","2025-05-21 21:07:42","2025-05-21 21:07:42","2025-05-21 21:07:42","109159","","","114","","International Journal of Surgery Case Reports","Successful surgical management of large pulmonary artery thrombosis in a patient with primary severe mitral regurgitation and complex congenital heart disease","","","","","","","en","","","","","DOI.org (Crossref)","","","","","","","","","","","","","","","","","","","","","","","","","","","","","","","","","","","","","","","","","","","","","","","","","","","","",""
"CQG3CFSL","journalArticle","2015","Vázquez, Roberto Mijangos; Chávez, Irma Ofelia Miranda; López, María Elena Soto; Bahena, Emilia Josefina Patiño; Zárate, Roberto Cano; Flores, Arianna Cristina Covarrubias; Colmenero, Juan Calderón; García, Alfonso Martínez; Hernández, Alfonso Buendía; Lans, Verónica Guarner; Salazar, Jorge Luis Cervantes","Anomalous origin of pulmonary branches from the ascending aorta. A report of five cases and review of the literature","Journal of Cardiology Cases","","18785409","10.1016/j.jccase.2014.08.003","https://linkinghub.elsevier.com/retrieve/pii/S187854091400098X","","2015-01","2025-05-21 21:07:46","2025-05-21 21:07:46","2025-05-21 21:07:46","1-6","","1","11","","Journal of Cardiology Cases","","","","","","","","en","","","","","DOI.org (Crossref)","","","","/home/fgsj/Zotero/storage/7YRI5JMQ/Vázquez et al. - 2015 - Anomalous origin of pulmonary branches from the ascending aorta. A report of five cases and review o.pdf","","","","","","","","","","","","","","","","","","","","","","","","","","","","","","","","","","","","","","","","","","","","","","","","",""
"7TS2MHU9","journalArticle","2019","Gupta, Punkaj; Gossett, Jeffrey M.; Kofos, Danny; Rettiganti, Mallikarjuna","Creation of an empiric tool to predict ECMO deployment in pediatric respiratory or cardiac failure","Journal of Critical Care","","08839441","10.1016/j.jcrc.2018.10.007","https://linkinghub.elsevier.com/retrieve/pii/S0883944118306609","","2019-02","2025-05-21 21:07:50","2025-05-21 21:07:50","2025-05-21 21:07:50","21-26","","","49","","Journal of Critical Care","","","","","","","","en","","","","","DOI.org (Crossref)","","","","","","","","","","","","","","","","","","","","","","","","","","","","","","","","","","","","","","","","","","","","","","","","","","","","",""
"V8MNTZ9U","journalArticle","2006","Smith, Heidi A.B.; Canter, Jeffrey A.; Christian, Karla G.; Drinkwater, Davis C.; Scholl, Frank G.; Christman, Brian W.; Rice, Geraldine D.; Barr, Frederick E.; Summar, Marshall L.","Nitric oxide precursors and congenital heart surgery: A randomized controlled trial of oral citrulline","The Journal of Thoracic and Cardiovascular Surgery","","00225223","10.1016/j.jtcvs.2006.02.012","https://linkinghub.elsevier.com/retrieve/pii/S0022522306003163","","2006-07","2025-05-21 21:07:52","2025-05-21 21:07:52","2025-05-21 21:07:52","58-65","","1","132","","The Journal of Thoracic and Cardiovascular Surgery","Nitric oxide precursors and congenital heart surgery","","","","","","","en","https://www.elsevier.com/tdm/userlicense/1.0/","","","","DOI.org (Crossref)","","","","","","","","","","","","","","","","","","","","","","","","","","","","","","","","","","","","","","","","","","","","","","","","","","","","",""
"NNVYZWZ5","journalArticle","2006","Beghetti, Maurice; Aggoun, Yacine; Da Cruz, Eduardo","Nitric oxide precursors and congenital cardiac surgery: A randomized controlled trial of oral citrulline. Definition of pulmonary hypertension in Fontan circulation?","The Journal of Thoracic and Cardiovascular Surgery","","00225223","10.1016/j.jtcvs.2006.07.031","https://linkinghub.elsevier.com/retrieve/pii/S0022522306014450","","2006-12","2025-05-21 21:07:54","2025-05-21 21:07:54","2025-05-21 21:07:54","1501-1502","","6","132","","The Journal of Thoracic and Cardiovascular Surgery","Nitric oxide precursors and congenital cardiac surgery","","","","","","","en","https://www.elsevier.com/tdm/userlicense/1.0/","","","","DOI.org (Crossref)","","","","/home/fgsj/Zotero/storage/9382XDWX/Beghetti et al. - 2006 - Nitric oxide precursors and congenital cardiac surgery A randomized controlled trial of oral citrul.pdf","","","","","","","","","","","","","","","","","","","","","","","","","","","","","","","","","","","","","","","","","","","","","","","","",""
"8ETIVJ5T","journalArticle","2007","Barr, Frederick E.; Tirona, Rommel G.; Taylor, Mary B.; Rice, Geraldine; Arnold, Judith; Cunningham, Gary; Smith, Heidi A.B.; Campbell, Adam; Canter, Jeffrey A.; Christian, Karla G.; Drinkwater, Davis C.; Scholl, Frank; Kavanaugh-McHugh, Ann; Summar, Marshall L.","Pharmacokinetics and safety of intravenously administered citrulline in children undergoing congenital heart surgery: Potential therapy for postoperative pulmonary hypertension","The Journal of Thoracic and Cardiovascular Surgery","","00225223","10.1016/j.jtcvs.2007.02.043","https://linkinghub.elsevier.com/retrieve/pii/S0022522307006162","","2007-08","2025-05-21 21:07:58","2025-05-21 21:07:58","2025-05-21 21:07:58","319-326","","2","134","","The Journal of Thoracic and Cardiovascular Surgery","Pharmacokinetics and safety of intravenously administered citrulline in children undergoing congenital heart surgery","","","","","","","en","https://www.elsevier.com/tdm/userlicense/1.0/","","","","DOI.org (Crossref)","","","","/home/fgsj/Zotero/storage/6SHWPKYU/Barr et al. - 2007 - Pharmacokinetics and safety of intravenously administered citrulline in children undergoing congenit.pdf","","","","","","","","","","","","","","","","","","","","","","","","","","","","","","","","","","","","","","","","","","","","","","","","",""
"LPGHTNV4","journalArticle","2021","Ishibashi, Nobuyuki; Jonas, Richard A.","Nitric oxide: An important contributor to neuroprotection during pediatric cardiac surgery","The Journal of Thoracic and Cardiovascular Surgery","","00225223","10.1016/j.jtcvs.2019.12.057","https://linkinghub.elsevier.com/retrieve/pii/S0022522320300325","","2021-06","2025-05-21 21:08:00","2025-05-22 11:31:37","2025-05-21 21:08:00","e499-e500","","6","161","","The Journal of Thoracic and Cardiovascular Surgery","Commentary","","","","","","","en","","","","","DOI.org (Crossref)","","","","/home/fgsj/Zotero/storage/X6UPEY2T/Ishibashi and Jonas - 2021 - Commentary Nitric oxide An important contributor to neuroprotection during pediatric cardiac surge.pdf","","","","","","","","","","","","","","","","","","","","","","","","","","","","","","","","","","","","","","","","","","","","","","","","",""
"3FLTBYUA","journalArticle","2019","Said, Sameh M.; Qureshi, Muhammad Yasir; Taggart, Nathaniel W.; Anderson, Heather N.; O'Leary, Patrick W.; Cetta, Frank; Alrahmani, Layan; Cofer, Shelagh A.; Segura, Leal G.; Pike, Roxann B.; Sharpe, Emily E.; Derleth, Douglas P.; Nemergut, Michael E.; Van Dorn, Charlotte S.; Gleich, Stephen J.; Rose, Carl H.; Collura, Christopher A.; Ruano, Rodrigo","Innovative 2-Step Management Strategy Utilizing EXIT Procedure for a Fetus With Hypoplastic Left Heart Syndrome and Intact Atrial Septum","Mayo Clinic Proceedings","","00256196","10.1016/j.mayocp.2018.08.004","https://linkinghub.elsevier.com/retrieve/pii/S0025619618305883","","2019-02","2025-05-21 21:08:05","2025-05-21 21:08:05","2025-05-21 21:08:05","356-361","","2","94","","Mayo Clinic Proceedings","","","","","","","","en","","","","","DOI.org (Crossref)","","","","","","","","","","","","","","","","","","","","","","","","","","","","","","","","","","","","","","","","","","","","","","","","","","","","",""
"XBENTWUC","journalArticle","2007","Canter, Jeffrey A.; Summar, Marshall L.; Smith, Heidi B.; Rice, Geraldine D.; Hall, Lynn D.; Ritchie, Marylyn D.; Motsinger, Alison A.; Christian, Karla G.; Drinkwater, Davis C.; Scholl, Frank G.; Dyer, Karrie L.; Kavanaugh-McHugh, Ann L.; Barr, Frederick E.","Genetic variation in the mitochondrial enzyme carbamyl-phosphate synthetase I predisposes children to increased pulmonary artery pressure following surgical repair of congenital heart defects: A validated genetic association study","Mitochondrion","","15677249","10.1016/j.mito.2006.11.001","https://linkinghub.elsevier.com/retrieve/pii/S1567724906002182","","2007-05","2025-05-21 21:08:06","2025-05-21 21:08:06","2025-05-21 21:08:06","204-210","","3","7","","Mitochondrion","Genetic variation in the mitochondrial enzyme carbamyl-phosphate synthetase I predisposes children to increased pulmonary artery pressure following surgical repair of congenital heart defects","","","","","","","en","https://www.elsevier.com/tdm/userlicense/1.0/","","","","DOI.org (Crossref)","","","","/home/fgsj/Zotero/storage/WTTSY7JM/Canter et al. - 2007 - Genetic variation in the mitochondrial enzyme carbamyl-phosphate synthetase I predisposes children t.pdf","","","","","","","","","","","","","","","","","","","","","","","","","","","","","","","","","","","","","","","","","","","","","","","","",""
"LAADNV7X","journalArticle","2015","Durkin, Chris; Buckland, Mark","Cardiopulmonary transplantation: anaesthetic implications","Anaesthesia & Intensive Care Medicine","","14720299","10.1016/j.mpaic.2015.04.010","https://linkinghub.elsevier.com/retrieve/pii/S1472029915000934","","2015-07","2025-05-21 21:08:11","2025-05-21 21:08:11","2025-05-21 21:08:11","324-327","","7","16","","Anaesthesia & Intensive Care Medicine","Cardiopulmonary transplantation","","","","","","","en","https://www.elsevier.com/tdm/userlicense/1.0/","","","","DOI.org (Crossref)","","","","","","","","","","","","","","","","","","","","","","","","","","","","","","","","","","","","","","","","","","","","","","","","","","","","",""
"CJYKCRL5","journalArticle","2024","Araki, Haruna; Shikata, Fumiaki; Torii, Shinzo; Kitamura, Tadashi; Mishima, Toshiaki; Fukuzumi, Masaomi; Motoji, Yusuke; Horikoshi, Rihito; Tamura, Yoshimi; Ishiwaki, Daiki; Hirata, Yoichiro; Miyaji, Kagami","Fast-track extubation guided by pulmonary artery pressure monitoring after ventricular septal defect closure in infants with pulmonary hypertension","Progress in Pediatric Cardiology","","10589813","10.1016/j.ppedcard.2024.101710","https://linkinghub.elsevier.com/retrieve/pii/S1058981324000080","","2024-03","2025-05-21 21:08:12","2025-05-21 21:08:12","2025-05-21 21:08:12","101710","","","72","","Progress in Pediatric Cardiology","","","","","","","","en","","","","","DOI.org (Crossref)","","","","","","","","","","","","","","","","","","","","","","","","","","","","","","","","","","","","","","","","","","","","","","","","","","","","",""
"WHWQY49C","journalArticle","2005","Tulloh, Robert M.R.","Congenital heart disease in relation to pulmonary hypertension in paediatric practice","Paediatric Respiratory Reviews","","15260542","10.1016/j.prrv.2005.06.010","https://linkinghub.elsevier.com/retrieve/pii/S1526054205000552","","2005-09","2025-05-21 21:08:14","2025-05-21 21:08:14","2025-05-21 21:08:14","174-180","","3","6","","Paediatric Respiratory Reviews","","","","","","","","en","https://www.elsevier.com/tdm/userlicense/1.0/","","","","DOI.org (Crossref)","","","","","","","","","","","","","","","","","","","","","","","","","","","","","","","","","","","","","","","","","","","","","","","","","","","","",""
"82USX5YZ","journalArticle","2007","Schell, David N.; Winlaw, David S.","Peri-operative management of paediatric patients undergoing cardiac surgery – focus on respiratory aspects of care","Paediatric Respiratory Reviews","","15260542","10.1016/j.prrv.2007.08.001","https://linkinghub.elsevier.com/retrieve/pii/S1526054207000759","","2007-12","2025-05-21 21:08:15","2025-05-21 21:08:15","2025-05-21 21:08:15","336-347","","4","8","","Paediatric Respiratory Reviews","","","","","","","","en","https://www.elsevier.com/tdm/userlicense/1.0/","","","","DOI.org (Crossref)","","","","","","","","","","","","","","","","","","","","","","","","","","","","","","","","","","","","","","","","","","","","","","","","","","","","",""
"CRBVW27N","journalArticle","2002","Riddle, Elise M; Feltes, Timothy F; Rosen, Kerry; Fraley, J.Kennard; Mott, Antonio R; Kovalchin, John P","Association of nitric oxide dose and methemoglobin levels in patients with congenital heart disease and pulmonary hypertension","The American Journal of Cardiology","","00029149","10.1016/S0002-9149(02)02509-2","https://linkinghub.elsevier.com/retrieve/pii/S0002914902025092","","2002-08","2025-05-21 21:08:17","2025-05-21 21:08:17","2025-05-21 21:08:17","442-444","","4","90","","The American Journal of Cardiology","","","","","","","","en","https://www.elsevier.com/tdm/userlicense/1.0/","","","","DOI.org (Crossref)","","","","","","","","","","","","","","","","","","","","","","","","","","","","","","","","","","","","","","","","","","","","","","","","","","","","",""
"ERX7JEE5","journalArticle","1997","Schulze-Neick, Ingram; Bültmann, Moritz; Werner, Heinrich; Gamillscheg, Andreas; Vogel, Michael; Berger, Felix; Rossaint, Rolf; Hetzer, Roland; Lange, Peter E.","Right Ventricular Function in Patients Treated With Inhaled Nitric Oxide After Cardiac Surgery for Congenital Heart Disease in Newborns and Children","The American Journal of Cardiology","","00029149","10.1016/S0002-9149(97)00367-6","https://linkinghub.elsevier.com/retrieve/pii/S0002914997003676","","1997-08","2025-05-21 21:08:19","2025-05-22 13:19:24","2025-05-21 21:08:19","360-363","","3","80","","The American Journal of Cardiology","","","","","","","","en","https://www.elsevier.com/tdm/userlicense/1.0/","","","","DOI.org (Crossref)","","","","","","","","","","","","","","","","","","","","","","","","","","","","","","","","","","","","","","","","","","","","","","","","","","","","",""
"3V8IRDXU","journalArticle","2000","Day, Ronald W; Hawkins, John A; McGough, Edwin C; Crezeé, Kevin L; Orsmond, Garth S","Randomized controlled study of inhaled nitric oxide after operation for congenital heart disease","The Annals of Thoracic Surgery","","00034975","10.1016/S0003-4975(00)01312-6","https://linkinghub.elsevier.com/retrieve/pii/S0003497500013126","","2000-06","2025-05-21 21:08:22","2025-05-21 21:08:22","2025-05-21 21:08:22","1907-1912","","6","69","","The Annals of Thoracic Surgery","","","","","","","","en","https://www.elsevier.com/tdm/userlicense/1.0/","","","","DOI.org (Crossref)","","","","","","","","","","","","","","","","","","","","","","","","","","","","","","","","","","","","","","","","","","","","","","","","","","","","",""
"P95NVGAG","journalArticle","2002","Gulati, Rajeev; Lell, William A; Pacifico, Albert D; Johnson, Walter H; Colvin, Edward V; Bhardwaj, Ashwani","Nitric oxide: lifesaving measure for pulmonary vasospasm after modified Blalock-Taussig shunt","The Annals of Thoracic Surgery","","00034975","10.1016/S0003-4975(02)03960-7","https://linkinghub.elsevier.com/retrieve/pii/S0003497502039607","","2002-11","2025-05-21 21:08:25","2025-05-21 21:08:25","2025-05-21 21:08:25","1700-1702","","5","74","","The Annals of Thoracic Surgery","Nitric oxide","","","","","","","en","https://www.elsevier.com/tdm/userlicense/1.0/","","","","DOI.org (Crossref)","","","","/home/fgsj/Zotero/storage/YE8F8JJY/Gulati et al. - 2002 - Nitric oxide lifesaving measure for pulmonary vasospasm after modified Blalock-Taussig shunt.pdf","","","","","","","","","","","","","","","","","","","","","","","","","","","","","","","","","","","","","","","","","","","","","","","","",""
"RRH6YEQP","journalArticle","1996","Goldman, Allan P.; Delius, Ralph E.; Deanfield, John E.; De Leval, Marc R.; Sigston, Paul E.; Macrae, Duncan J.","Nitric Oxide Might Reduce the Need for Extracorporeal Support in Children With Critical Postoperative Pulmonary Hypertension","The Annals of Thoracic Surgery","","00034975","10.1016/S0003-4975(96)00375-X","https://linkinghub.elsevier.com/retrieve/pii/S000349759600375X","","1996-08","2025-05-21 21:08:28","2025-05-21 21:08:28","2025-05-21 21:08:28","750-755","","3","62","","The Annals of Thoracic Surgery","","","","","","","","en","https://www.elsevier.com/tdm/userlicense/1.0/","","","","DOI.org (Crossref)","","","","","","","","","","","","","","","","","","","","","","","","","","","","","","","","","","","","","","","","","","","","","","","","","","","","",""
"WZNK2Q5R","journalArticle","1996","Atz, Andrew M; Adatia, Ian; Wessel, David L","Rebound Pulmonary Hypertension After Inhalation of Nitric Oxide","The Annals of Thoracic Surgery","","00034975","10.1016/S0003-4975(96)00542-5","https://linkinghub.elsevier.com/retrieve/pii/S0003497596005425","","1996-12","2025-05-21 21:08:29","2025-05-21 21:08:29","2025-05-21 21:08:29","1759-1764","","6","62","","The Annals of Thoracic Surgery","","","","","","","","en","https://www.elsevier.com/tdm/userlicense/1.0/","","","","DOI.org (Crossref)","","","","/home/fgsj/Zotero/storage/W32A972K/Atz et al. - 1996 - Rebound Pulmonary Hypertension After Inhalation of Nitric Oxide.pdf","","","","","","","","","","","","","","","","","","","","","","","","","","","","","","","","","","","","","","","","","","","","","","","","",""
